iter	kernel	tflops	hw_eff_pct	decision	bottleneck	idea_summary	run_command
iter000_cublas	cublas_gemmex_bf16_fp32	38.10	100.00	BASELINE	n/a	cuBLAS bf16->fp32 with tensor core and fp32 accumulation. Primary baseline.	./baseline_cublas 10 20
iter000_torch_bf16	torch.mm_bf16	41.43	108.74	BASELINE	n/a	torch.mm pure bf16 (wrong output dtype but fastest).	python3 -c "torch.mm(a_bf16, b_bf16)"
iter000_torch_cast	torch.mm_fp32_cast	11.18	29.34	BASELINE	n/a	torch.mm with bf16->fp32 cast before matmul (slow).	python3 -c "torch.mm(a.float(), b.float())"
iter000_torch_fp32	torch.mm_fp32	12.53	32.89	BASELINE	n/a	torch.mm pure fp32 (no tensor cores).	python3 -c "torch.mm(a_fp32, b_fp32)"
iter001	iter001_draft_wmma	9.91	26.01	DISCARD	latency_bound	First WMMA bf16 kernel draft. 5-way bank conflict (79.56%).	./iter001_draft 5 10
iter002	iter002_no_bank_conflict	18.90	49.61	KEEP	latency_bound	Fix shared memory bank conflicts with padding (+8 bf16 per row). +90.7% gain.	./iter002_no_bank_conflict 5 10
